{
  "manifest_id": "reproduction:vajra:local-smoke",
  "version": 1,
  "description": "Minimal deterministic smoke test for the Vajra Reproduction Engine.",
  "execution_mode": "local",
  "working_directory": ".",
  "timeout_seconds": 10,
  "command": [
    "python",
    "-c",
    "from pathlib import Path; Path('reproduction-output.txt').write_bytes(b'vajra\\n')"
  ],
  "expected_exit_code": 0,
  "environment": {
    "PYTHONHASHSEED": "0"
  },
  "inputs": [],
  "outputs": [
    {
      "path": "reproduction-output.txt",
      "required": true,
      "sha256": "0411eb92bf46b462ac6f80254a4f50484273491ba37cb5c00825d2d5d93798a5"
    }
  ],
  "metadata": {
    "purpose": "engine-smoke-test",
    "scientific_claim": false
  }
}
